{
  "id": "ds_linked_list",
  "schemaVersion": 1,
  "domain": "data-structures",
  "topic": "Linked List",
  "aliases": ["Singly Linked List", "Node Chain", "Head Pointer", "Next Reference", "Pointer List"],
  "difficulty": "beginner",
  "prerequisites": ["Reference", "Object", "Loop", "Null"],
  "nextTopics": ["Stack", "Queue", "Doubly Linked List", "Binary Tree"],
  "definition": "A linked list is a data structure made of nodes where each node stores data and a reference to the next node in the sequence.",
  "deepExplanation": "A singly linked list is not stored as one continuous block like an array. The list is found by starting at the head reference and following each node's next reference until null. This makes insertion at the front simple because the new node only needs to point to the old head. It also means random access is slow because the only way to reach the kth node is to walk through the chain one node at a time.",
  "whyItMatters": "Linked lists teach reference-based thinking, which is essential for stacks, queues, trees, graphs, and many pointer manipulation problems.",
  "analogy": "Think of a treasure hunt where each clue tells you where the next clue is. You cannot jump straight to clue seven unless you follow the chain from the beginning.",
  "codeExamples": [
    {
      "language": "java",
      "title": "Node class, traversal, and insert at front",
      "code": "class Node {\n  int data;\n  Node next;\n\n  Node(int data) {\n    this.data = data;\n  }\n}\n\nNode insertFront(Node head, int value) {\n  Node newNode = new Node(value);\n  newNode.next = head;\n  return newNode;\n}\n\nvoid printList(Node head) {\n  Node current = head;\n  while (current != null) {\n    System.out.println(current.data);\n    current = current.next;\n  }\n}",
      "walkthrough": [
        {
          "lineRange": "1-7",
          "text": "Each Node stores a data value and a next reference to another Node."
        },
        {
          "lineRange": "10-11",
          "text": "insertFront creates a new node for the value being inserted."
        },
        {
          "lineRange": "12",
          "text": "The new node points to the old head, preserving the rest of the list."
        },
        {
          "lineRange": "13",
          "text": "The new node becomes the new head, so callers must keep this returned reference."
        },
        {
          "lineRange": "17-21",
          "text": "Traversal starts at head and repeatedly follows next until it reaches null."
        }
      ]
    },
    {
      "language": "java",
      "title": "Delete after a known node safely",
      "code": "void deleteAfter(Node node) {\n  if (node == null || node.next == null) {\n    return;\n  }\n  Node removed = node.next;\n  node.next = removed.next;\n  removed.next = null;\n}",
      "walkthrough": [
        {
          "lineRange": "2-4",
          "text": "The guard prevents deleting after a missing node or after the tail."
        },
        {
          "lineRange": "5",
          "text": "Store the node being removed before changing links so the operation is easy to reason about."
        },
        {
          "lineRange": "6",
          "text": "Bypass the removed node by pointing the current node to the removed node's next."
        },
        {
          "lineRange": "7",
          "text": "Clearing removed.next helps show that the removed node is no longer part of the chain."
        }
      ]
    }
  ],
  "diagrams": [
    {
      "type": "linked_list",
      "title": "Singly Linked List Memory Model",
      "nodes": ["head", "Node(10)", "Node(20)", "Node(30)", "null"],
      "edges": [
        ["head", "Node(10)", "points to"],
        ["Node(10)", "Node(20)", "next"],
        ["Node(20)", "Node(30)", "next"],
        ["Node(30)", "null", "next"]
      ],
      "caption": "The head reference points to the first node, and each node points to the next node until null."
    },
    {
      "type": "operation_sequence",
      "title": "Insert at Front",
      "nodes": ["new Node(5)", "old head Node(10)", "head"],
      "edges": [
        ["new Node(5)", "old head Node(10)", "newNode.next"],
        ["head", "new Node(5)", "return new head"]
      ],
      "caption": "Insertion at the front preserves the old chain by linking the new node to the old head before returning it."
    }
  ],
  "commonMistakes": [
    {
      "mistake": "Overwriting next before saving the rest of the chain.",
      "whyItHappens": "Students update references in the wrong order and lose access to later nodes.",
      "correction": "Store important references first, then rewire links deliberately."
    },
    {
      "mistake": "Forgetting to stop traversal at null.",
      "whyItHappens": "It is easy to write current.next without checking whether current exists.",
      "correction": "Use while (current != null) for traversal and guard operations near the tail."
    },
    {
      "mistake": "Assuming linked lists have O(1) access by index.",
      "whyItHappens": "The list looks ordered, so beginners expect array-like indexing.",
      "correction": "Remember that reaching an index requires following next references from head."
    }
  ],
  "bestPractices": [
    "Draw the before and after references before coding insertion or deletion.",
    "Always keep track of the head reference because losing it loses the list.",
    "Use guard checks for null before reading node.next.",
    "Return the new head from operations that might change the first node."
  ],
  "complexity": {
    "accessByIndex": "O(n)",
    "search": "O(n)",
    "traversal": "O(n)",
    "insertAtHead": "O(1)",
    "insertAfterKnownNode": "O(1)",
    "deleteAfterKnownNode": "O(1)",
    "space": "O(n)"
  },
  "miniQuiz": [
    {
      "question": "When inserting at the front, what should newNode.next point to before returning?",
      "options": ["null", "The old head", "The tail", "The new node itself"],
      "answer": "The old head",
      "explanation": "Pointing newNode.next to the old head preserves the existing chain behind the new first node."
    },
    {
      "question": "Why is access by index O(n) in a singly linked list?",
      "options": ["Nodes are sorted", "There is no direct jump to an index", "Each node stores an array", "The head is always null"],
      "answer": "There is no direct jump to an index",
      "explanation": "To reach index k, the program must follow next references from the head through earlier nodes."
    }
  ],
  "flashcards": [
    {
      "front": "What does the head reference store?",
      "back": "The head reference points to the first node in the linked list.",
      "difficulty": "easy"
    },
    {
      "front": "What does a node contain in a singly linked list?",
      "back": "A data value and a next reference to the following node.",
      "difficulty": "easy"
    },
    {
      "front": "Why can insert-at-head be O(1)?",
      "back": "It only creates one node, points it to the old head, and returns it as the new head.",
      "difficulty": "medium"
    }
  ],
  "visualTemplates": ["linked_list", "operation_sequence", "complexity_table"],
  "source": {
    "type": "curated",
    "license": "project-authored"
  }
}
